{
  "$schema": "../../../schemas/citychat-icon-resolution.schema.v0.6.1.json",
  "schemaVersion": "1.0",
  "resolutionVersion": "citychat-icon-resolution-v0.6.1",
  "artifactVersion": "0.6.1",
  "status": "governed_local_bindings_only",
  "scope": "citychat_team_playground_only",
  "fontManifestRef": "font-assets.manifest.json",
  "iconMapRef": "citychat-icon-map.json",
  "fontAssetId": "material-symbols-rounded-citychat-v368-static-24-300-0-0",
  "bindings": [
    {
      "bindingId": "control-examples.open-icon-map-circle",
      "selector": "#open-icon-map-circle",
      "iconSelector": "#open-icon-map-circle .icon-symbol",
      "controlKind": "local_document_link",
      "effectClass": "local_only_no_remote_effect",
      "roleId": "evidence",
      "glyph": "description",
      "labelMode": "accessible_name",
      "iconAccessibility": "aria-hidden",
      "axisState": { "FILL": 0, "wght": 300, "GRAD": 0, "opsz": 24 },
      "colorMode": "currentColor_from_citychat_role",
      "colorRoleRef": "citychat.action.default",
      "surfaceContractRef": "inherits_governed_control_foreground_and_surface"
    },
    {
      "bindingId": "icon-reference.open-icon-map",
      "selector": "#open-icon-map",
      "iconSelector": "#open-icon-map .icon-symbol",
      "controlKind": "local_document_link",
      "effectClass": "local_only_no_remote_effect",
      "roleId": "evidence",
      "glyph": "description",
      "labelMode": "visible_label",
      "iconAccessibility": "aria-hidden",
      "axisState": { "FILL": 0, "wght": 300, "GRAD": 0, "opsz": 24 },
      "colorMode": "currentColor_from_citychat_role",
      "colorRoleRef": "citychat.action.default",
      "surfaceContractRef": "inherits_governed_control_foreground_and_surface"
    },
    {
      "bindingId": "motion-examples.open-motion-recipe",
      "selector": "#open-motion-recipe",
      "iconSelector": "#open-motion-recipe .icon-symbol",
      "controlKind": "local_document_link",
      "effectClass": "local_only_no_remote_effect",
      "roleId": "evidence",
      "glyph": "description",
      "labelMode": "visible_label",
      "iconAccessibility": "aria-hidden",
      "axisState": { "FILL": 0, "wght": 300, "GRAD": 0, "opsz": 24 },
      "colorMode": "currentColor_from_citychat_role",
      "colorRoleRef": "citychat.action.default",
      "surfaceContractRef": "inherits_governed_control_foreground_and_surface"
    },
    {
      "bindingId": "color-atlas.open-color-role-map",
      "selector": "#open-color-role-map",
      "iconSelector": "#open-color-role-map .icon-symbol",
      "controlKind": "local_document_link",
      "effectClass": "local_only_no_remote_effect",
      "roleId": "evidence",
      "glyph": "description",
      "labelMode": "visible_label",
      "iconAccessibility": "aria-hidden",
      "axisState": { "FILL": 0, "wght": 300, "GRAD": 0, "opsz": 24 },
      "colorMode": "currentColor_from_citychat_role",
      "colorRoleRef": "citychat.action.default",
      "surfaceContractRef": "inherits_governed_control_foreground_and_surface"
    },
    {
      "bindingId": "implementation-library.control-examples-link",
      "selector": "#implementation-library .implementation-router a[href='#control-examples']",
      "iconSelector": "#implementation-library .implementation-router a[href='#control-examples'] .icon-symbol",
      "controlKind": "local_section_navigation",
      "effectClass": "local_only_no_remote_effect",
      "roleId": "evidence",
      "glyph": "description",
      "labelMode": "visible_label",
      "iconAccessibility": "aria-hidden",
      "axisState": { "FILL": 0, "wght": 300, "GRAD": 0, "opsz": 24 },
      "colorMode": "currentColor_from_citychat_role",
      "colorRoleRef": "citychat.action.default",
      "surfaceContractRef": "inherits_governed_control_foreground_and_surface"
    },
    {
      "bindingId": "implementation-library.icon-reference-link",
      "selector": "#implementation-library .implementation-router a[href='#icon-reference']",
      "iconSelector": "#implementation-library .implementation-router a[href='#icon-reference'] .icon-symbol",
      "controlKind": "local_section_navigation",
      "effectClass": "local_only_no_remote_effect",
      "roleId": "evidence",
      "glyph": "description",
      "labelMode": "visible_label",
      "iconAccessibility": "aria-hidden",
      "axisState": { "FILL": 0, "wght": 300, "GRAD": 0, "opsz": 24 },
      "colorMode": "currentColor_from_citychat_role",
      "colorRoleRef": "citychat.action.default",
      "surfaceContractRef": "inherits_governed_control_foreground_and_surface"
    },
    {
      "bindingId": "implementation-library.motion-examples-link",
      "selector": "#implementation-library .implementation-router a[href='#motion-examples']",
      "iconSelector": "#implementation-library .implementation-router a[href='#motion-examples'] .icon-symbol",
      "controlKind": "local_section_navigation",
      "effectClass": "local_only_no_remote_effect",
      "roleId": "evidence",
      "glyph": "description",
      "labelMode": "visible_label",
      "iconAccessibility": "aria-hidden",
      "axisState": { "FILL": 0, "wght": 300, "GRAD": 0, "opsz": 24 },
      "colorMode": "currentColor_from_citychat_role",
      "colorRoleRef": "citychat.action.default",
      "surfaceContractRef": "inherits_governed_control_foreground_and_surface"
    },
    {
      "bindingId": "implementation-library.color-atlas-link",
      "selector": "#implementation-library .implementation-router a[href='#color-atlas']",
      "iconSelector": "#implementation-library .implementation-router a[href='#color-atlas'] .icon-symbol",
      "controlKind": "local_section_navigation",
      "effectClass": "local_only_no_remote_effect",
      "roleId": "evidence",
      "glyph": "description",
      "labelMode": "visible_label",
      "iconAccessibility": "aria-hidden",
      "axisState": { "FILL": 0, "wght": 300, "GRAD": 0, "opsz": 24 },
      "colorMode": "currentColor_from_citychat_role",
      "colorRoleRef": "citychat.action.default",
      "surfaceContractRef": "inherits_governed_control_foreground_and_surface"
    },
    {
      "bindingId": "control-examples.open-lds-button-rules",
      "selector": "#open-lds-button-rules",
      "iconSelector": "#open-lds-button-rules .icon-symbol",
      "controlKind": "local_document_link",
      "effectClass": "local_only_no_remote_effect",
      "roleId": "evidence",
      "glyph": "description",
      "labelMode": "visible_label",
      "iconAccessibility": "aria-hidden",
      "axisState": { "FILL": 0, "wght": 300, "GRAD": 0, "opsz": 24 },
      "colorMode": "currentColor_from_citychat_role",
      "colorRoleRef": "citychat.action.default",
      "surfaceContractRef": "inherits_governed_control_foreground_and_surface"
    },
    {
      "bindingId": "motion-examples.evidence-disclosure",
      "selector": "#motion-examples .motion-evidence-disclosure > summary",
      "iconSelector": "#motion-examples .motion-evidence-disclosure > summary .icon-symbol",
      "controlKind": "local_teaching_action",
      "effectClass": "local_only_no_remote_effect",
      "roleId": "evidence",
      "glyph": "description",
      "labelMode": "visible_label",
      "iconAccessibility": "aria-hidden",
      "axisState": { "FILL": 0, "wght": 300, "GRAD": 0, "opsz": 24 },
      "colorMode": "currentColor_from_citychat_role",
      "colorRoleRef": "citychat.action.default",
      "surfaceContractRef": "inherits_governed_control_foreground_and_surface"
    },
    {
      "bindingId": "color-atlas.open-control-examples",
      "selector": "#open-control-examples",
      "iconSelector": "#open-control-examples .icon-symbol",
      "controlKind": "local_section_navigation",
      "effectClass": "local_only_no_remote_effect",
      "roleId": "evidence",
      "glyph": "description",
      "labelMode": "visible_label",
      "iconAccessibility": "aria-hidden",
      "axisState": { "FILL": 0, "wght": 300, "GRAD": 0, "opsz": 24 },
      "colorMode": "currentColor_from_citychat_role",
      "colorRoleRef": "citychat.action.default",
      "surfaceContractRef": "inherits_governed_control_foreground_and_surface"
    }
  ],
  "librarySpecimens": {
    "containerSelector": "#icon-reference [role=list]",
    "roleIds": ["place", "conversation", "evidence", "reply", "share", "history", "receipt", "officer_work", "map"],
    "nonInteractive": true,
    "productCapabilityEnabled": false
  },
  "excludedProductCapabilities": [
    { "roleId": "reply", "glyph": "reply", "capabilityId": "replyAction", "currentArtifactState": false, "reason": "No evidenced CityChat reply mutation exists in this team playground." },
    { "roleId": "share", "glyph": "share", "capabilityId": "networkShare", "currentArtifactState": false, "reason": "release.config.json declares networkShare false." },
    { "roleId": "history", "glyph": "history", "capabilityId": "remotePersistence", "currentArtifactState": false, "reason": "The return scene is a synthetic teaching fixture, not real versioned history." },
    { "roleId": "receipt", "glyph": "receipt_long", "capabilityId": "remotePersistence", "currentArtifactState": false, "reason": "release.config.json declares remotePersistence false." },
    { "roleId": "officer_work", "glyph": "assignment", "capabilityId": "officerOperations", "currentArtifactState": false, "reason": "release.config.json declares officerOperations false." }
  ],
  "blockedBindings": []
}
